{
  "$schema": "http://json-schema.org/draft-07/schema#",
  "$id": "orbit://schemas/tool.schema.json",
  "title": "Orbit Tool",
  "description": "A tool Orbit's AI can call. One file per tool in %APPDATA%\\Orbit\\tools\\ (subfolders allowed). Changes are loaded immediately.",
  "type": "object",
  "additionalProperties": false,
  "required": ["name", "description", "action"],
  "properties": {
    "$schema": { "type": "string" },
    "name": {
      "description": "Unique technical name used by the model.",
      "type": "string",
      "pattern": "^[a-z][a-z0-9_]{1,63}$"
    },
    "title": {
      "description": "Display name in the UI: a plain string or per language, e.g. { \"en\": \"Weather\", \"de\": \"Wetter\" }.",
      "$ref": "#/definitions/localizedText"
    },
    "description": {
      "description": "When and what the tool is used for. The model decides based on this text alone: be specific. English recommended (small models select tools more reliably).",
      "type": "string",
      "minLength": 1
    },
    "enabled": {
      "description": "false = the tool is not loaded.",
      "type": "boolean",
      "default": true
    },
    "permission": {
      "description": "auto = run immediately, confirm = ask first (default).",
      "enum": ["auto", "confirm"],
      "default": "confirm"
    },
    "parameters": { "$ref": "#/definitions/parameters" },
    "triggers": {
      "description": "Fast path: phrases that run the tool immediately without asking the AI. Syntax: {parameter} captures text, (a|b) alternatives, [optional]. Case-insensitive. May contain phrases in several languages.",
      "type": "array",
      "items": {
        "anyOf": [
          { "$ref": "#/definitions/triggerPattern" },
          {
            "type": "object",
            "additionalProperties": false,
            "required": ["pattern"],
            "properties": {
              "pattern": { "$ref": "#/definitions/triggerPattern" },
              "args": { "type": "object", "description": "Fixed parameter values for this trigger." }
            }
          }
        ]
      }
    },
    "action": { "$ref": "#/definitions/action" }
  },
  "definitions": {
    "localizedText": {
      "anyOf": [
        { "type": "string", "minLength": 1 },
        {
          "type": "object",
          "minProperties": 1,
          "propertyNames": { "pattern": "^[a-z]{2}(-[A-Z]{2})?$" },
          "additionalProperties": { "type": "string", "minLength": 1 }
        }
      ]
    },
    "triggerPattern": {
      "type": "string",
      "minLength": 1,
      "examples": ["(spiele|play) {query} (auf|on) spotify", "(öffne|open) [(die|the)] [app] {name}", "g {query}"]
    },
    "parameters": {
      "description": "Parameters the model fills in (JSON schema object with simple values).",
      "type": "object",
      "additionalProperties": false,
      "properties": {
        "type": { "const": "object" },
        "properties": {
          "type": "object",
          "propertyNames": { "pattern": "^[A-Za-z_][A-Za-z0-9_]*$" },
          "additionalProperties": { "$ref": "#/definitions/param" }
        },
        "required": {
          "type": "array",
          "items": { "type": "string" },
          "uniqueItems": true
        }
      }
    },
    "param": {
      "type": "object",
      "additionalProperties": false,
      "required": ["type"],
      "properties": {
        "type": { "enum": ["string", "number", "integer", "boolean"] },
        "description": { "type": "string", "description": "Helps the model fill in the value correctly." },
        "enum": { "type": "array", "description": "Allowed values.", "minItems": 1 },
        "default": { "description": "Value used when the model omits the parameter." }
      }
    },
    "template": {
      "type": "string",
      "description": "Text with {{parameter}} placeholders. Filters: {{name|raw}}, {{name|url}}, {{name|json}}. API keys from the vault: {{secret:name}}."
    },
    "timeoutSecs": {
      "type": "integer",
      "minimum": 1,
      "description": "Timeout in seconds (default 30)."
    },
    "action": {
      "type": "object",
      "required": ["type"],
      "properties": {
        "type": {
          "description": "open_url | launch | powershell | http | builtin",
          "enum": ["open_url", "launch", "powershell", "http", "builtin"]
        }
      },
      "allOf": [
        {
          "if": { "properties": { "type": { "const": "open_url" } } },
          "then": {
            "description": "Opens a URL/URI with the default handler. Placeholders are URL-encoded. A scheme fixed in the template (e.g. ms-settings:) is allowed, otherwise only http/https.",
            "additionalProperties": false,
            "required": ["type", "url"],
            "properties": {
              "type": { "const": "open_url" },
              "url": { "$ref": "#/definitions/template" }
            }
          }
        },
        {
          "if": { "properties": { "type": { "const": "launch" } } },
          "then": {
            "description": "Starts a program directly (no shell). %ENVIRONMENT_VARIABLES% are expanded, empty arguments dropped.",
            "additionalProperties": false,
            "required": ["type", "program"],
            "properties": {
              "type": { "const": "launch" },
              "program": { "$ref": "#/definitions/template" },
              "args": { "type": "array", "items": { "$ref": "#/definitions/template" } },
              "cwd": { "$ref": "#/definitions/template" }
            }
          }
        },
        {
          "if": { "properties": { "type": { "const": "powershell" } } },
          "then": {
            "description": "Runs a fixed PowerShell script. Parameters are available as $env:ORBIT_ARG_<NAME> ({{placeholders}} are not allowed, to prevent code injection). The output goes to the model.",
            "additionalProperties": false,
            "required": ["type", "script"],
            "properties": {
              "type": { "const": "powershell" },
              "script": { "type": "string", "not": { "pattern": "\\{\\{" } },
              "timeoutSecs": { "$ref": "#/definitions/timeoutSecs" }
            }
          }
        },
        {
          "if": { "properties": { "type": { "const": "http" } } },
          "then": {
            "description": "HTTP request; the response body goes to the model. Placeholders: URL-encoded in url, raw in headers, JSON in body.",
            "additionalProperties": false,
            "required": ["type", "url"],
            "properties": {
              "type": { "const": "http" },
              "method": { "enum": ["GET", "POST"], "default": "GET" },
              "url": { "allOf": [{ "$ref": "#/definitions/template" }, { "pattern": "^[Hh][Tt][Tt][Pp][Ss]?://" }] },
              "headers": { "type": "object", "additionalProperties": { "$ref": "#/definitions/template" } },
              "body": { "$ref": "#/definitions/template" },
              "timeoutSecs": { "$ref": "#/definitions/timeoutSecs" }
            }
          }
        },
        {
          "if": { "properties": { "type": { "const": "builtin" } } },
          "then": {
            "description": "A function built into Orbit.",
            "additionalProperties": false,
            "required": ["type", "id"],
            "properties": {
              "type": { "const": "builtin" },
              "id": {
                "enum": ["datetime", "clipboard_read", "clipboard_write", "open_app", "spotify_play", "media_control", "radio"],
                "description": "Required parameters: clipboard_write → text · open_app → name · spotify_play → query (optional kind) · media_control → action (optional level, amount) · radio → device, state."
              }
            }
          }
        }
      ]
    }
  }
}
