{
  "$schema": "../../schemas/tool.schema.json",
  "name": "google_search",
  "title": { "en": "Google search", "de": "Google-Suche" },
  "description": "Shows a Google search in Orbit's web tab. Use this only when the user explicitly wants to google something or see Google. To answer a question from the web, use web_search instead.",
  "permission": "auto",
  "parameters": {
    "type": "object",
    "properties": {
      "query": { "type": "string", "description": "The search term" }
    },
    "required": ["query"]
  },
  "triggers": ["g {query}", "(google|googel|google mal) nach {query}", "(google|search google) for {query}"],
  "action": {
    "type": "open_url",
    "url": "https://www.google.com/search?q={{query}}",
    "target": "orbit"
  }
}