{
  "$schema": "../../schemas/tool.schema.json",
  "name": "spotify_play",
  "title": "Spotify",
  "description": "Plays music on Spotify: a song, an album, an artist or a playlist. Use this when the user wants to listen to music or play something on Spotify.",
  "permission": "auto",
  "parameters": {
    "type": "object",
    "properties": {
      "query": { "type": "string", "description": "Title and artist, e.g. 'Another Love Tom Odell'" },
      "kind": {
        "type": "string",
        "description": "track = song, album, artist or playlist",
        "enum": ["track", "album", "artist", "playlist"],
        "default": "track"
      }
    },
    "required": ["query"]
  },
  "triggers": [
    "(spiele|spiel|play|hör|höre|öffne|open) {query} (auf|in|bei|mit|on|via) spotify",
    { "pattern": "(spiele|spiel|play|hör|höre|öffne|open) [(das|the)] album {query} (auf|in|bei|mit|on|via) spotify", "args": { "kind": "album" } },
    { "pattern": "(spiele|spiel|play|hör|höre|öffne|open) [(die|the)] playlist {query} (auf|in|bei|mit|on|via) spotify", "args": { "kind": "playlist" } }
  ],
  "action": {
    "type": "builtin",
    "id": "spotify_play"
  }
}