{
  "$schema": "../../schemas/tool.schema.json",
  "name": "fetch_page",
  "title": { "en": "Read page", "de": "Seite lesen" },
  "description": "Reads a web page and returns its text. Use it when search excerpts are not enough, e.g. to read an article from the results or a page the user names. Only public web addresses.",
  "permission": "auto",
  "parameters": {
    "type": "object",
    "properties": {
      "url": { "type": "string", "description": "Full address starting with https:// or http://" }
    },
    "required": ["url"]
  },
  "action": {
    "type": "builtin",
    "id": "fetch_page"
  }
}
